1,"Howling II: … Your Sister is a Werewolf, A young man whose sister was murdered by werewolves helps an investigator track down a gang of the monsters through the United States and Europe."
1,"The Blancheville Monster, The beautiful young daughter of a crazed count fears that she will fall victim to the family curse - to be sacrificed to fulfill an ancient family legend."
1,"Hell Fest, A masked serial killer turns a horror-themed amusement park into his own personal playground, terrorizing a group of friends while the rest of the patrons believe that it is all part of the show."
2,"Aquaman, Arthur Curry learns that he is the heir to the underwater kingdom of Atlantis, and must step forward to lead his people and be a hero to the world."
2,"Titans, A team of young superheroes led by Nightwing (formerly Batman's first Robin) form to combat evil and other perils."
2,"The Flash, After being struck by lightning, Barry Allen wakes up from his coma to discover he's been given the power of super speed, becoming the Flash, fighting crime in Central City."
3,"They Shall Not Grow Old, A documentary about World War I with never-before-seen footage to commemorate the centennial of the end of the war."
3,"Three Identical Strangers, In 1980 New York, three young men who were all adopted meet each other and find out they're triplets who were separated at birth. Then they discover why."
3,"Making a Murderer, Filmed over a 10-year period, Steven Avery, a DNA exoneree who, while in the midst of exposing corruption in local law enforcement, finds himself the prime suspect in a grisly new crime."